學院,科系,招收,年級限制,成績要求,繳交資料,先修課程,測驗,備註,聯絡電話,課程備註,課程名稱
社會科學院,法律學系學士班,,,其前一學年每學期學業成績平均達80分以上或總名次在該班學生人數前10%以內者為限。總名次計算至前一學年度第一學期為止。,,,,,分機56100,"c(""須修畢 50 學分"")","c(""憲法"", ""行政法"", ""民法總則"", ""民法債編總論"" , ""民法債編各論"", ""民法物權編"", ""民事訴訟法"", ""刑法總則"", ""刑法分則"", ""刑事訴訟法"",  ""民法親屬編與繼承編"", ""公司法"", ""海商法"", ""票據法"", ""保險法"", ""綜合法學實例演練"")"
社會科學院,政治學系學士班,,,學生前一學年每學期平均成績須達75分以上。,,,,,分機50255,"c(""須修畢 必修51 學分"", ""以上課程若於外系或外校修習通過而獲本系系主任同意者得予抵免，但至多不得逾15學分。科目名稱相同但學分數不足者，得經系主任同意後，修習本系選修課程抵充之"")","c(""政治學概論（一）"", ""政治學概論（二）"", ""社會學概論"", ""法學緒論"", ""經濟學原理（一）"", ""經濟學原理（二）"", ""中華民國憲法與政府"", ""政治經濟學"", ""政治學方法論（一）"", ""政治學方法論（二）"", ""政治哲學概論"", ""兩岸關係"", ""應用統計"" , ""比較政治與政府"", ""行政學"", ""國際關係"", ""公共政策"")"
社會科學院,經濟學系學士班,,,前一學期成績排序需達全班名列前1/3。,,須先選修「經濟學原理」6學分，且該科成績學年平均80分以上。,,,分機56300,"c(""須修畢 必修 42 學分，選修 6 學分"", ""標示 * 為 「經濟分析工具領域」，任選一科，下表所列僅為部分課程，全部課程依當學年排定課程而定"", ""標示 ** 為 「應用經濟領域」，任選一科，下表所列僅為部分課程，全部課程依當學年排定課程而定"", ""以上課程若已修畢外系所開而獲本系系主任同意免再修習者，仍應選讀「加修科目」補足48學分。「加修科目」之選擇範圍為本系系定選修課程（經濟分析工具及應用經濟領域）。惟統計學、微積分可開放至外系選修。"")","c(""經濟學原理(一)"", ""經濟學原理(二)"", ""統計學(一)"", ""統計學(二)"", ""微積分(一)"", ""微積分(二)"", ""個體經濟學(一)"", ""個體經濟學(二)"", ""總體經濟學(一)"", ""總體經濟學(二)"", ""公共財政學"", ""貨幣銀行學"", ""國際金融"", ""國際貿易"", ""計量經濟學(一)*"", ""計量經濟學(二)*"", ""經濟成長*"", ""財務計算與數據分析*"", ""經濟發展與幸福經濟*"", ""數理經濟學*"", ""經濟數學*"", ""數理統計學*"", ""社會科學程式設計*"", ""賽局與經濟*"", ""計算經濟學*"", ""經濟發展*"", ""天然災害經濟分析*"", ""高齡經濟分析**"", ""資源與環境經濟學**"", ""財務經濟學**"", ""法律經濟學**"", ""健康經濟學**"", ""西洋經濟史**"", ""都市經濟學**"", ""總體經濟分析與政策**"", ""神經經濟學**"", ""勞動經濟學**"")"
社會科學院,心理學系學士班,,,其前一學年每學期學業成績平均達80分以上或前一學期成績名次在該班學生人數前10%以內者為限。,,,,,分機56500,"c(""須修畢本系之所有必修 共 41 學分"", ""心理測驗需先修統計(一)和統計(二)"", ""認知心理學需先修心概(一)和心概(二)"")","c(""心理學概論（一）"", ""心理與教育統計學（一）"", ""心理學概論（二）"", ""心理與教育統計學（二）"", ""心理實驗法（一）"", ""心理測驗"", ""性格心理學"", ""心理實驗法（二）"", ""發展心理學"", ""認知心理學"", ""生理心理學"", ""生理心理學實驗"", ""感覺與知覺"", ""社會心理學"")"
電機資訊學院,電機工程學系學士班,,,前一學期分數達83分（含）以上，或成績名次在該班學生人數20%以內。,歷年成績單、選課申請表(請至本系網頁自行下載)，須繳交至本系學士班承辦人處。,,,,分機62313,"c(""須修畢必修至少 51 學分，且不得改選其它必選或選修科目代替。"", ""若原學系必修課程與表列課程名稱相同，以致加修科目不足51學分時，學生得改選【E2電機系/N2電機所/Q1微電子所/Q3電通所/Q7奈米學程】之其它課程補足51學分。例1. 機械系-計算機概論、電機系-計算機概論(一)：名稱不同。例2. 統計系-微積分(一)、電機系-微積分(一)：名稱相同"")","c(""微積分(一)"", ""微積分(二)"", ""計算機概論(一)"", ""計算機概論(二)"", ""線性代數"", ""工程數學(一)"", ""工程數學(二)"", ""電路學(一)"", ""電路學(二)"", ""電子學(一)"", ""電子學(二)"", ""電子學(三)"", ""電工實驗"", ""電機概論實驗"", ""控制工程實驗"", ""普通物理學(一)"", ""普通物理學(二)"", ""普通物理學實驗(一)"", ""普通物理學實驗(二)"", ""電機概論"", ""電儀表學"", ""控制工程"", ""電子電路實驗(一)"", ""電子電路實驗(二)"", ""電磁學(一)"", ""電磁學(二)"", ""邏輯系統實驗"", ""電儀表學實驗"", ""通訊實驗"")"
電機資訊學院,資訊工程學系學士班,,,前一學期平均分數達75分以上(含)且成績名次在該班學人數40%以內，由本系成立評審委員會審查。先修課程：必須完成先修課程：微積分（一）（二）、計算機概論，方能提出申請。,系申請書(請至本系網頁下載)、校申請書、歷年成績單、學生證影印本。申請書先請原系主任簽核後併同其他資料送至資訊系系辦公室。,必須完成微積分（一）（二）、計算機概論，方能提出申請。,,,分機62500-11,"c(""須修畢 先修課程 6 學分、必修至少 28 學分和選修課程"", ""微積分為先修課程"", ""選修課程：本系開設之大學部選修科目至多承認12學分"", ""標示 * 課程中至少選修24學分"")","c(""微積分(一)"", ""微積分(二)"", ""資訊專題(一)"", ""資訊專題(二)"", ""程式設計（一）*"", ""程式設計（二）*"", ""數位電路導論*"", ""計算機組織*"", ""資料結構*"", ""數位系統導論*"", ""數位系統實驗*"", ""離散數學*"", ""作業系統*"", ""微算機原理與應用（含實驗）*"", ""演算法*"", ""編譯系統*"")"
規劃與設計學院,建築學系學士班,不招收雙主修,,,,,,,分機54147,,
規劃與設計學院,都巿計劃學系學士班,,,,審查資料包括： (1)在校歷年成績單(須包含至申請期限時各學期完整成績)； (2)自傳；(3)讀書計畫(含申請動機)；(4)其他有利審查之資料(如：作品集...等)。收件處為本系助教室。,,,,分機54237,"c(""**在這裡選修課程為所列課表中需要選修（任選幾科）的課程** 例：微積分或統計學納入選修學分數"", ""微積分與統計學 任選一科"", ""標示 * 的課程共有八科，任選四科，共計 8~10 學分"")","c(""基本設計（二）"", ""都市規劃與設計實習（一）"", ""都市計劃概論"", ""經濟學"", ""都市規劃與設計實習（二）"", ""都市規劃與設計實習（三）"", ""規劃分析方法"", ""都市經濟學"", ""都市交通計劃"", ""都市土地使用計劃"", ""都市規劃與設計實習（四）"", ""都市設計"", ""都市及區域計劃法規"", ""微積分"", ""統計學"", ""設計概論*"", ""都市社會學*"", ""都市工程學*"", ""區域計劃概論*"", ""都市財政學*"", ""地理資訊系統概論*"", ""圖學*"", ""都市規劃與設計實習（五）*"")"
規劃與設計學院,工業設計學系學士班,,,本地生：學業成績名次列該班前1/5者。僑生：學業成績名次列該班前1/2者。,,曾修物理一學期及微積分一學期成績及格者。,性向檢定（含素描及空間概念）合格。(受理報名預定每年四月下旬，測驗日期預定五月中旬)。並於性向檢定前提出方可報名。,,06-2757575轉54343,,
生物科學與科技學院,生命科學系學士班,,二年級（含）以上。,前學期學業成績平均達75分。,,,,,分機58121,"c(""須修畢 必修 33 學分，選修學分數 7 學分"", ""植物生理學與動物生理學 二選一"", ""書報討論(一)(二) 二選一"", ""本系專業選修至少 7 學分，課程列於資料中"")","c(""普通生物學(一)"", ""普通生物學實驗(一)"", ""普通生物學(二)"", ""普通生物學實驗(二)"", ""生物化學(一)"", ""生物化學實驗(一)"", ""遺傳學"", ""遺傳學實驗"", ""生態學"", ""生物統計學"", ""植物生理學"", ""動物生理學"", ""書報討論(一)"", ""書報討論(二)"", ""生物化學(二)"", ""細胞生物學"", ""酵素學"", ""營養學"", ""分子生物學"", ""免疫學"", ""植物細胞與組織培養"", ""生物資訊學導論"", ""動物生理學實驗"", ""分子細胞學"", ""蛋白質化學"", ""演化生物學"", ""生態學實驗"", ""比較解剖學"", ""動物組織學"", ""植物型態與解剖學"", ""功能性生物資料分析"", ""染色體學"", ""環境政策"",  ""生物資料庫簡介與實作"", ""生命科學與諾貝爾獎"", ""基因體與生物技術理論與實作"", ""神經生物學"", ""生態模型導論"", ""哺乳動物學"", ""鳥類學"", ""蘭花生物科技學"", ""全球變遷生物學"", ""生命科學討論(一)"", ""生命科學討論(二)"", ""實習課程"", ""實驗室實習(一)"", ""實驗室實習(二)"", ""生命科學專題研究(一)"", ""生命科學專題研究(二)"", ""論文(一)"", ""論文(二)"")"
生物科學與科技學院,生物科技與產業科學系學士班,,二年級（含）以上。,前一學年之平均GPA需達3或名次在該班學生人數前20%以內。,申請表及歷年成績單。,,,,分機58202,"c(""須修畢 必修 40 學分"", ""申請者於主系修過之科目與本系必修科目性質相同或類似者，經本系課程委員會同意得免 修，但不列為雙主修學分數"", ""必修課程若不足 40 學分，需另修習本系選修課程以達到 40 學 分之要求"")",